{"active_regions":[{"area_msh":1343.046249,"birth_seconds":0.0,"complexity":0.662803,"confidence":0.65,"flux_norm":1.948099,"id":1,"lat_deg":30.6828,"lon_deg":125.114606,"polarity":"leading_positive","tilt_deg":18.752729},{"area_msh":1439.670055,"birth_seconds":0.0,"complexity":0.716483,"confidence":0.65,"flux_norm":1.512351,"id":2,"lat_deg":-28.741567,"lon_deg":217.89192,"polarity":"leading_negative","tilt_deg":-7.36752},{"area_msh":1504.912493,"birth_seconds":0.0,"complexity":0.752729,"confidence":0.65,"flux_norm":1.688849,"id":3,"lat_deg":-30.103876,"lon_deg":206.938802,"polarity":"leading_negative","tilt_deg":-9.415133},{"area_msh":853.420485,"birth_seconds":0.0,"complexity":0.390789,"confidence":0.65,"flux_norm":0.818998,"id":4,"lat_deg":30.720756,"lon_deg":173.291972,"polarity":"leading_positive","tilt_deg":13.513267},{"area_msh":1677.888531,"birth_seconds":0.0,"complexity":0.848827,"confidence":0.65,"flux_norm":0.89727,"id":5,"lat_deg":-26.036002,"lon_deg":230.040619,"polarity":"leading_positive","tilt_deg":-14.174961},{"area_msh":1180.972545,"birth_seconds":0.0,"complexity":0.572763,"confidence":0.65,"flux_norm":1.279346,"id":6,"lat_deg":-27.008555,"lon_deg":225.542389,"polarity":"leading_negative","tilt_deg":-7.262244},{"area_msh":1745.554984,"birth_seconds":0.0,"complexity":0.886419,"confidence":0.65,"flux_norm":1.885227,"id":7,"lat_deg":-31.497463,"lon_deg":270.965691,"polarity":"leading_negative","tilt_deg":-5.661219},{"area_msh":1135.255456,"birth_seconds":0.0,"complexity":0.547364,"confidence":0.65,"flux_norm":1.238583,"id":8,"lat_deg":-27.77814,"lon_deg":64.155901,"polarity":"leading_negative","tilt_deg":-17.843569},{"area_msh":1059.935506,"birth_seconds":0.0,"complexity":0.50552,"confidence":0.65,"flux_norm":0.569672,"id":9,"lat_deg":-25.262268,"lon_deg":150.339009,"polarity":"leading_positive","tilt_deg":-5.583003},{"area_msh":1698.409692,"birth_seconds":0.0,"complexity":0.860228,"confidence":0.65,"flux_norm":2.008213,"id":10,"lat_deg":-30.577124,"lon_deg":115.006387,"polarity":"leading_negative","tilt_deg":-5.292112},{"area_msh":1785.662045,"birth_seconds":0.0,"complexity":0.908701,"confidence":0.65,"flux_norm":0.729106,"id":11,"lat_deg":-32.214968,"lon_deg":62.502508,"polarity":"leading_negative","tilt_deg":-10.347905},{"area_msh":1311.599036,"birth_seconds":0.0,"complexity":0.645333,"confidence":0.65,"flux_norm":0.957233,"id":12,"lat_deg":-25.963969,"lon_deg":147.670289,"polarity":"leading_negative","tilt_deg":-19.325214},{"area_msh":1668.287202,"birth_seconds":0.0,"complexity":0.843493,"confidence":0.65,"flux_norm":2.111782,"id":13,"lat_deg":32.932071,"lon_deg":250.028906,"polarity":"leading_positive","tilt_deg":7.080502},{"area_msh":1855.822515,"birth_seconds":0.0,"complexity":0.947679,"confidence":0.65,"flux_norm":0.543886,"id":14,"lat_deg":-27.067885,"lon_deg":245.924966,"polarity":"leading_negative","tilt_deg":-17.813183},{"area_msh":1926.102974,"birth_seconds":0.0,"complexity":0.986724,"confidence":0.65,"flux_norm":1.166419,"id":15,"lat_deg":-27.363647,"lon_deg":251.586134,"polarity":"leading_negative","tilt_deg":-12.025483},{"area_msh":1324.854175,"birth_seconds":0.0,"complexity":0.652697,"confidence":0.65,"flux_norm":1.885905,"id":16,"lat_deg":31.708709,"lon_deg":62.552868,"polarity":"leading_positive","tilt_deg":21.873567},{"area_msh":1796.720658,"birth_seconds":0.0,"complexity":0.914845,"confidence":0.65,"flux_norm":2.267182,"id":17,"lat_deg":-26.931452,"lon_deg":189.046117,"polarity":"leading_negative","tilt_deg":-18.533264},{"area_msh":914.43876,"birth_seconds":0.0,"complexity":0.424688,"confidence":0.65,"flux_norm":1.026823,"id":18,"lat_deg":-29.282997,"lon_deg":326.350009,"polarity":"leading_negative","tilt_deg":-10.816008},{"area_msh":1343.332335,"birth_seconds":0.0,"complexity":0.662962,"confidence":0.65,"flux_norm":1.797411,"id":19,"lat_deg":-31.423877,"lon_deg":341.956539,"polarity":"leading_negative","tilt_deg":-18.866417},{"area_msh":1533.334284,"birth_seconds":0.0,"complexity":0.768519,"confidence":0.65,"flux_norm":1.153858,"id":20,"lat_deg":28.838493,"lon_deg":208.592094,"polarity":"leading_positive","tilt_deg":7.508354},{"area_msh":847.099234,"birth_seconds":0.0,"complexity":0.387277,"confidence":0.65,"flux_norm":1.129198,"id":21,"lat_deg":-25.166887,"lon_deg":55.014782,"polarity":"leading_negative","tilt_deg":-10.648691},{"area_msh":1266.269234,"birth_seconds":0.0,"complexity":0.62015,"confidence":0.65,"flux_norm":1.323222,"id":22,"lat_deg":-28.423677,"lon_deg":155.478968,"polarity":"leading_negative","tilt_deg":-8.361089},{"area_msh":1923.979163,"birth_seconds":0.0,"complexity":0.985544,"confidence":0.65,"flux_norm":1.402921,"id":23,"lat_deg":-28.932109,"lon_deg":345.970764,"polarity":"leading_negative","tilt_deg":-15.969798},{"area_msh":1035.857263,"birth_seconds":0.0,"complexity":0.492143,"confidence":0.65,"flux_norm":0.510797,"id":24,"lat_deg":31.549848,"lon_deg":337.056312,"polarity":"leading_positive","tilt_deg":6.327865},{"area_msh":976.631512,"birth_seconds":0.0,"complexity":0.45924,"confidence":0.65,"flux_norm":1.5717,"id":25,"lat_deg":-31.380422,"lon_deg":263.467532,"polarity":"leading_negative","tilt_deg":-21.822011}],"calibration_state":"normalized magnetic units; physical Gauss/Mx calibration not asserted","coordinates":{"central_meridian_longitude_deg":0.0,"frame":"heliographic_carrington","latitude_type":"heliographic","longitude_positive":"west","observer":"sun_center","reference_epoch_jd_tt":2451545.0,"rotation_reference_deg_per_day":14.1844},"fields":{"br_normalized":{"units":"normalized magnetic field","values":[0.0,0.0,0.0,0.0,0.0,0.0,0.0,0.0,0.0,0.0,0.0,0.0,0.0,0.0,0.0,0.0,0.0,0.0,0.0,0.0,0.0,0.0,0.0,0.0,0.0,0.0,0.0,0.0,0.0,0.0,0.0,0.0,0.0,0.0,0.0,0.0,0.0,0.0,0.0,0.0,0.0,0.0,0.0,0.0,0.0,0.0,0.0,0.0,0.0,0.0,0.0,0.0,0.0,0.0,0.0,0.0,0.0,0.0,0.0,0.0,0.0,0.0,0.0,0.0,0.0,0.0,0.0,0.0,0.0,0.0,0.0,0.0,0.0,0.0,0.0,0.0,0.0,0.0,0.0,0.0,0.0,0.0,0.0,0.0,0.0,0.0,0.0,0.0,0.0,0.0,0.0,0.0,0.0,0.0,0.0,0.0,0.0,0.0,0.0,0.0,0.0,0.0,0.0,0.0,0.0,0.0,0.0,0.0,0.0,0.0,0.0,0.0,0.0,0.0,0.0,0.0,0.0,0.0,0.0,0.0,0.0,0.0,0.0,0.0,0.0,0.0,0.0,0.0,0.0,0.0,0.0,0.0,0.0,0.0,0.0,0.0,0.0,0.0,0.0,0.0,0.0,0.0,0.0,0.0,0.0,0.0,0.0,0.0,0.0,0.0,-2e-06,-0.0,0.0,0.0,0.0,0.0,0.0,0.0,0.0,0.0,0.0,0.0,0.0,0.0,0.0,0.0,0.0,0.0,0.0,-0.0,-1e-06,-1e-06,-0.0,0.0,0.0,0.0,0.0,-0.0,-2e-06,-0.0,0.0,0.0,0.0,0.0,1e-06,0.073758,-0.453623,-0.000733,0.0,0.0,0.008287,-0.059478,-0.014096,0.0,-2e-06,-0.007512,-0.001287,0.0,0.001038,-0.023146,0.078928,-0.019173,-0.023074,0.002401,-0.000214,-0.010413,-0.407124,-0.792788,-7.5e-05,0.0,0.0,4.2e-05,0.006558,0.069511,-1.021627,-0.015521,0.0,0.0,0.0,0.0,0.007556,0.056077,0.003984,-0.001283,0.0,0.0,0.005459,0.028527,-0.002885,0.000256,0.595051,0.497992,-0.009191,0.000164,1.25,-0.593572,0.227005,0.552938,-0.477963,0.527338,0.731185,-0.475745,0.064326,-0.030863,-3e-06,0.0,0.0,0.000335,0.221006,0.039004,0.315443,-0.014772,0.0,0.0,0.0,0.0,2e-06,0.000153,1e-06,-0.0,0.0,0.0,0.0,0.0,0.0,0.0,0.000126,2.6e-05,-0.0,0.0,0.000102,-0.0,0.0,0.0,-9e-05,3e-06,1.6e-05,-0.0,-0.0,0.0,0.0,0.0,0.0,0.0,0.0,0.0,0.0,0.0,0.0,0.0,0.0,0.0,0.0,0.0,0.0,0.0,0.0,0.0,0.0,0.0,0.0,0.0,0.0,0.0,0.0,0.0,0.0,0.0,0.0,0.0,0.0,0.0,0.0,0.0,0.0,0.0,0.0,0.0,0.0,0.0,0.0,0.0,0.0,0.0,0.0,0.0,0.0,0.0,0.0,0.0,0.0,0.0,0.0,0.0,0.0,0.0,0.0,0.0,0.0,0.0,0.0,0.0,0.0,0.0,0.0,0.0,0.0,0.0,0.0,0.0,0.0,0.0,0.0,0.0,0.0,0.0,0.0,0.0,0.0,0.0,0.0,0.0,0.0,0.0,0.0,0.0,0.0,0.0,0.0,0.0,0.0,0.0,0.0,0.0,0.0,0.0,0.0,0.0,0.0,-0.0,-0.0,-0.0,0.0,0.0,0.0,0.0,0.0,0.0,0.0,0.0,0.0,0.0,0.0,0.0,0.0,0.0,0.0,0.0,0.0,0.0,0.0,-0.020123,-0.002396,3e-06,0.0,0.0,0.0,-0.003583,-0.126235,0.000639,0.0,0.0,-0.004087,0.006091,1.4e-05,-5.1e-05,-0.420281,0.106278,0.0,-0.0,-0.013553,0.004012,0.0,0.0,0.0,0.0,0.0,0.0,-9e-06,-0.015384,0.000808,0.0,0.0,0.0,0.0,0.0,0.0,-0.051466,1.22353,0.000472,0.0,0.0,0.0,-0.002013,0.246971,0.012182,0.0,0.0,-0.005219,0.214839,0.000137,-3e-06,-0.024971,0.030768,0.0,-1.4e-05,-1.014978,1.25,2.2e-05,0.0,0.0,0.0,0.0,0.0,-7.7e-05,-0.115082,0.020092,0.0,0.0,0.0,0.0,0.0,0.0,0.0,5e-06,0.0,0.0,0.0,0.0,0.0,0.0,0.0,0.0,0.0,0.0,0.0,0.0,0.0,0.0,0.0,0.0,-0.0,-2e-06,1.4e-05,0.0,0.0,0.0,0.0,0.0,0.0,-0.0,-0.0,0.0,0.0,0.0,0.0,0.0,0.0,0.0,0.0,0.0,0.0,0.0,0.0,0.0,0.0,0.0,0.0,0.0,0.0,0.0,0.0,0.0,0.0,0.0,0.0,0.0,0.0,0.0,0.0,0.0,0.0,0.0,0.0,0.0,0.0,0.0,0.0,0.0,0.0,0.0,0.0,0.0,0.0,0.0,0.0,0.0,0.0,0.0,0.0,0.0,0.0,0.0,0.0,0.0,0.0,0.0,0.0,0.0,0.0,0.0,0.0,0.0,0.0,0.0,0.0,0.0,0.0,0.0,0.0,0.0,0.0,0.0,0.0,0.0,0.0,0.0,0.0,0.0,0.0,0.0,0.0,0.0,0.0,0.0,0.0,0.0,0.0,0.0,0.0,0.0,0.0,0.0,0.0,0.0,0.0,0.0,0.0,0.0,0.0,0.0,0.0,0.0,0.0,0.0,0.0,0.0,0.0,0.0,0.0,0.0,0.0,0.0,0.0,0.0,0.0,0.0,0.0,0.0,0.0,0.0,0.0,0.0,0.0,0.0,0.0,0.0,0.0,0.0,0.0,0.0,0.0,0.0,0.0,0.0,0.0,0.0,0.0,0.0,0.0,0.0,0.0,0.0,0.0,0.0,0.0,0.0,0.0]},"br_variance_normalized":{"units":"normalized variance","values":[0.78,0.78,0.78,0.78,0.78,0.78,0.78,0.78,0.78,0.78,0.78,0.78,0.78,0.78,0.78,0.78,0.78,0.78,0.78,0.78,0.78,0.78,0.78,0.78,0.78,0.78,0.78,0.78,0.78,0.78,0.78,0.78,0.78,0.78,0.78,0.78,0.78,0.78,0.78,0.78,0.78,0.78,0.78,0.78,0.78,0.78,0.78,0.78,0.78,0.78,0.78,0.78,0.78,0.78,0.78,0.78,0.78,0.78,0.78,0.78,0.78,0.78,0.78,0.78,0.78,0.78,0.78,0.78,0.78,0.78,0.78,0.78,0.78,0.78,0.78,0.78,0.78,0.78,0.78,0.78,0.78,0.78,0.78,0.78,0.78,0.78,0.78,0.78,0.78,0.78,0.78,0.78,0.78,0.78,0.78,0.78,0.78,0.78,0.78,0.78,0.78,0.78,0.78,0.78,0.78,0.78,0.78,0.78,0.78,0.78,0.78,0.78,0.78,0.78,0.78,0.78,0.78,0.78,0.78,0.78,0.78,0.78,0.78,0.78,0.78,0.78,0.78,0.78,0.78,0.78,0.78,0.78,0.78,0.78,0.78,0.78,0.78,0.78,0.78,0.78,0.78,0.78,0.78,0.78,0.78,0.78,0.78,0.78,0.78,0.78,0.78,0.78,0.78,0.78,0.78,0.78,0.78,0.78,0.78,0.78,0.78,0.78,0.78,0.78,0.78,0.78,0.78,0.78,0.78,0.78,0.78,0.78,0.78,0.78,0.78,0.78,0.78,0.78,0.78,0.78,0.78,0.78,0.78,0.78,0.78,0.222825,0.222825,0.78,0.78,0.78,0.78,0.234943,0.78,0.78,0.78,0.294963,0.78,0.78,0.78,0.78,0.261818,0.261818,0.270879,0.78,0.78,0.33519,0.228395,0.228395,0.78,0.78,0.78,0.78,0.343828,0.284259,0.203614,0.78,0.78,0.78,0.78,0.78,0.78,0.353181,0.313159,0.78,0.78,0.78,0.78,0.234943,0.78,0.78,0.288667,0.288667